[{
  "photo": "/_images/dso.jpg",
  "startDate": "2017-03-01T08:00:00.000Z",
  "endDate": null,
  "headline": "Digital Skills Observatory (DSO) research published",
  "description": "DSO is a 12-month research project carried out by Mozilla and partners, and supported by the Bill & Melinda Gates Foundation. Research explores how low-income, first-time Internet users in Kenya experience online life.",
  "link": {
    "url": "#TODO",
    "description": "View the research"
  }
}]
